{
  "schema_version": "1.1",
  "job_id": "job_compile_001",
  "status": "queued",
  "job_type": "compile_context",
  "project_id": "proj_customer_support_ai",
  "created_at": "2026-02-21T10:30:00-06:00",
  "updated_at": "2026-02-21T10:30:00-06:00",
  "trace_id": "trc_compile_001",
  "result_refs": []
}
